Accession	Name	Description	Source Database
IPR016112	Group II dsDNA virus coat/capsid protein	"Hexon is a major coat protein found in various species-specific Adenoviruses, which are type II dsDNA viruses. Hexon coat proteins are synthesised during late infection and form homo-trimers. The 240 copies of the hexon trimer that are produced are organised so that 12 lie on each of the 20 facets. The central 9 hexons in a facet are cemented together by 12 copies of polypeptide IX. The penton complex, formed by the peripentonal hexons and base hexon (holding in place a fibre), lie at each of the 12 vertices [[cite:PUB00003331]]. The hexon coat protein is a duplication consisting of two domains with a similar fold packed together like the nucleoplasmin subunits. Within a hexon trimer, the domains are arranged around a pseudo 6-fold axis. The domains have a β-sandwich structure consisting of 8 strands in two sheets with a jelly-roll topology; each domain is heavily decorated with many insertions [[cite:PUB00022393]]. The major capsid proteins (vp54 and vp72) found in Iridoviruses, Phycodnaviruses, Asfarviruses and Ascoviruses share the same structure. All these viruses are type II dsDNA viruses with no RNA stage. This is the most abundant structural protein and can account for up to 45% of virion protein [[cite:PUB00010097]]. The structure of vp54 has been determined from Paramecium bursaria Chlorella virus 1 (PBCV-1), a very large icosahedral virus containing an internal membrane enclosed within a glycoprotein coat. The vp54 protein is a duplication consisting of two domains with a similar fold packed together like the nucleoplasmin subunits. The vp54 protein forms a trimer, where the domains are arranged around a pseudo 6-fold axis. The domains have a β-sandwich structure consisting of 8 strands in two sheets with a jelly-roll topology [[cite:PUB00022136]].



Similarly, the major capsid protein p3 from Bacteriophage PRD1 also adopts a similar double-barrel structure comprising two eight-stranded viral β-barrels or jelly rolls, each of which contains a 12-residue α-helix. This protein then trimerises through a 'trimerisation loop' sequence, and is incorporated within the viral capsid [[cite:PUB00028629]]."	INTERPRO
IPR037293	Galactose oxidase, central domain superfamily	"This entry represents a β-propeller domain found in galactose oxidase.



Galactose oxidase ([ec:1.1.3.9]) is a monomeric enzyme that contains a single copper ion and catalyses the stereospecific oxidation of primary alcohols to their corresponding aldehyde [[cite:PUB00014151]]. The protein contains an unusual covalent thioether bond between a tyrosine and a cysteine that forms during its maturation [[cite:PUB00014152]]. Galactose oxidase is a three-domain protein: the N-terminal domain forms a jelly-roll sandwich, the central domain forms a seven 4-bladed β-propeller, and the C-terminal domain has an immunoglobulin-like fold."	INTERPRO
IPR008979	Galactose-binding-like domain superfamily	"Proteins containing a galactose-binding-like domain fold can be found in several different protein families, in both eukaryotes and prokaryotes.  The common function of these domains is to bind to specific ligands, such as cell-surface-attached carbohydrate substrates for galactose oxidase and sialidase [[cite:PUB00004093]], phospholipids on the outer side of the mammalian cell membrane for coagulation factor Va [[cite:PUB00010664]], membrane-anchored ephrin for the Eph family of receptor tyrosine kinases [[cite:PUB00010665]], and a complex of broken single-stranded DNA and DNA polymerase beta for XRCC1 [[cite:PUB00005865]].

The structure of the galactose-binding-like domain members consists of a β-sandwich, in which the strands making up the sheets exhibit a jelly roll fold.  There is a high degree of similarity in the β-sandwich and in the loops between different family members, despite an often low level of sequence similarity."	INTERPRO
IPR016107	Adenovirus Pll, hexon, N-terminal	Hexon is a major coat protein found in various species-specific Adenoviruses, which are type II dsDNA viruses. Hexon coat proteins are synthesised during late infection and form homo-trimers. The 240 copies of the hexon trimer that are produced are organised so that 12 lie on each of the 20 facets. The central 9 hexons in a facet are cemented together by 12 copies of polypeptide IX. The penton complex, formed by the peripentonal hexons and base hexon (holding in place a fibre), lie at each of the 12 vertices [[cite:PUB00003331]]. The hexon coat protein is a duplication consisting of two domains with a similar fold packed together like the nucleoplasmin subunits. Within a hexon trimer, the domains are arranged around a pseudo 6-fold axis. The domains have a β-sandwich structure consisting of 8 strands in two sheets with a jelly-roll topology; each domain is heavily decorated with many insertions [[cite:PUB00022393]]. This entry represents the N-terminal domain of hexon coat proteins.	INTERPRO
IPR016108	Adenovirus Pll, hexon, C-terminal	Hexon is a major coat protein found in various species-specific Adenoviruses, which are type II dsDNA viruses. Hexon coat proteins are synthesised during late infection and form homo-trimers. The 240 copies of the hexon trimer that are produced are organised so that 12 lie on each of the 20 facets. The central 9 hexons in a facet are cemented together by 12 copies of polypeptide IX. The penton complex, formed by the peripentonal hexons and base hexon (holding in place a fibre), lie at each of the 12 vertices [[cite:PUB00003331]]. The hexon coat protein is a duplication consisting of two domains with a similar fold packed together like the nucleoplasmin subunits. Within a hexon trimer, the domains are arranged around a pseudo 6-fold axis. The domains have a β-sandwich structure consisting of 8 strands in two sheets with a jelly-roll topology; each domain is heavily decorated with many insertions [[cite:PUB00022393]]. This entry represents the C-terminal domain of hexon coat proteins.	INTERPRO
PF20160	C-JID domain	C-terminal jelly roll/Ig-like domain (C-JID) was defined in cryogenic electron microscopy (cryoEM) structures of plant intracellular immune receptors containing Toll/interleukin-1 receptor (TIR, PF01582), nucleotide-binding (NB-ARC, PF00931) and leucine-rich repeat (LRR) domains (TIR-NLRs) [[cite:PUB00098643],[cite:PUB00098642]]. Structurally, the C-JID core is represented by a beta-sandwich made up of 8 to 9 beta-strands. C-JID matches the so-called post-LRR or C-terminal non-LRR domain detected earlier via MEME and BLAST searches [[cite:PUB00098644],[cite:PUB00100184]]. The domain showed a strong distribution bias towards TIR-NLRs of dicotyledonous plant species despite broader taxonomic distribution of TIR-NLR in plant groups [1-7]. Structure-function analyses of cryoEM structures suggest that C-JID domains play a role in substrate recognition, such as binding to effector proteins from pathogens, and thus are involved in the initiation of signaling by TIR-NLR receptors [[cite:PUB00098643],[cite:PUB00098642]]. Presence of C-JID (or post-LRR) and its importance for the function of Arabidopsis TIR-NLR RPS4 that partners with RRS1 for effector recognition suggest that C-JID has additional functions [4-6].	PFAM
IPR038519	Major capsid protein, C-terminal domain superfamily	The entry includes major capsid proteins (vp54 and vp72) found in Iridoviruses, Phycodnaviruses, Asfarviruses and Ascoviruses, which are all type II dsDNA viruses with no RNA stage. This is the most abundant structural protein and can account for up to 45% of virion protein [[cite:PUB00010097]]. The structure of vp54 has been determined from Paramecium bursaria Chlorella virus 1 (PBCV-1), a very large icosahedral virus containing an internal membrane enclosed within a glycoprotein coat. The vp54 protein is a duplication consisting of two domains with a similar fold packed together like the nucleoplasmin subunits. The vp54 protein forms a trimer, where the domains are arranged around a pseudo 6-fold axis. The domains have a β-sandwich structure consisting of 8 strands in two sheets with a jelly-roll topology [[cite:PUB00022136]].	INTERPRO
IPR000757	Glycoside hydrolase family 16	"The glycosyl hydrolases family 16 (GH16) [[cite:PUB00000503]] contains functionally heterogeneous members, including lichenase ([ec:3.2.1.73]); xyloglucan xyloglucosyltransferase ([ec:2.4.1.207]); agarase ([ec:3.2.1.81]); kappa-carrageenase ([ec:3.2.1.83]); endo-beta-1,3-glucanase ([ec:3.2.1.39]); endo-beta-1,3-1,4-glucanase ([ec:3.2.1.6]); endo-beta-galactosidase ([ec:3.2.1.103]). These enzymes share a common ancestor and have diverged significantly in their primary sequence.

The GH16 catalytic domain has a classical sandwich-like β-jelly roll fold, formed by two main, closely packed and curved antiparallel β-sheets, creating a deep channel harboring the catalytic machinery. Even though the GH16 domains have now diverged significantly in their primary sequences, they all feature a common catalytic motif, E-[ILV]-D-[IVAF]-[VILMF](0,1)-E. The two glutamic acid residues in the conserved motif are the nucleophile and the general base involved in catalysis, whereas the aspartic acid residue is important in maintaining the relative position of these catalytic amino acids [[cite:PUB00029321], [cite:PUB00010686]].

Two closely clustered conserved glutamates have been shown [[cite:PUB00002845]] to be involved in the catalytic activity of Bacillus licheniformis lichenase. This domain contains these residues."	INTERPRO
PF17993	Haemagglutinin 70 C-terminal domain	This is the C-terminal domain found in hemagglutinin component such as HA70 found in Clostridium botulinum. HA is a component of the large botulinum neurotoxin complex and is critical for its oral toxicity. HA plays multiple roles in toxin penetration in the gastrointestinal tract, including protection from the digestive environment, binding to the intestinal mucosal surface, and disruption of the epithelial barrier [[cite:PUB00091177]]. HA consists of three different proteins, designated HA70 (also known as HA3), HA33 (HA1), and HA17 (HA2) based on molecular mass [[cite:PUB00091109]]. HA70 consists of three domains (D1-3). The D1 and D2 domains, which adopt similar structures, mediate the trimerization of HA70 with each protomer. The D3 domain, sitting at the tip of the trimer, is composed of two similar jelly-roll-like beta-sandwich structures [[cite:PUB00091178]]. Furthermore, crystal structures of HA70 in a complex with alpha2,3- or alpha2,6-SiaLac (alpha2,6-sialyllactose), show that alpha2,3- and alpha2,6-SiaLac bound to the same region in the D3 domain of HA70. This domain is the D3 domain found in HA3/HA70 which has been shown to be involved in binding to carbohydrate of glycoproteins from epithelial cells in the infection process [[cite:PUB00091109]].	PFAM
IPR040597	Hemagglutinin component HA-70, C-terminal	This is the C-terminal domain found in hemagglutinin component such as HA70 from Clostridium botulinum. HA is a component of the large botulinum neurotoxin complex and is critical for its oral toxicity. HA plays multiple roles in toxin penetration in the gastrointestinal tract, including protection from the digestive environment, binding to the intestinal mucosal surface, and disruption of the epithelial barrier [[cite:PUB00091177]]. HA consists of three different proteins, designated HA70 (also known as HA3), HA33 (HA1), and HA17 (HA2) based on molecular mass [[cite:PUB00091109]]. HA70 consists of three domains (D1-3). The D1 and D2 domains, which adopt similar structures, mediate the trimerization of HA70 with each protomer. The D3 domain, sitting at the tip of the trimer, is composed of two similar jelly-roll-like β-sandwich structures [[cite:PUB00091178]]. Furthermore, crystal structures of HA70 in a complex with alpha2,3-or alpha2,6-SiaLac (alpha2,6-sialyllactose), show that alpha2,3-and alpha2,6-SiaLac bound to the same region in the D3 domain of HA70. This domain is the D3 domain found in HA3/HA70 which has been shown to be involved in binding to carbohydrate of glycoproteins from epithelial cells in the infection process [[cite:PUB00091109]].	INTERPRO
IPR045344	C-JID domain	C-terminal jelly roll/Ig-like domain (C-JID) was defined in cryogenic electron microscopy (cryoEM) structures of plant intracellular immune receptors containing Toll/interleukin-1 receptor (TIR), nucleotide-binding (NB-ARC) and leucine-rich repeat (LRR) domains (TIR-NLRs) [[cite:PUB00098643], [cite:PUB00098642]]. Structurally, the C-JID core is represented by a β-sandwich made up of 8 to 9 β-strands. C-JID matches the so-called post-LRR or C-terminal non-LRR domain detected earlier via MEME and BLAST searches [[cite:PUB00098644], [cite:PUB00100184]]. The domain showed a strong distribution bias towards TIR-NLRs of dicotyledonous plant species despite broader taxonomic distribution of TIR-NLR in plant groups [[cite:PUB00098643], [cite:PUB00098642], [cite:PUB00098644], [cite:PUB00100184]]. Structure-function analyses of cryoEM structures suggest that C-JID domains play a role in substrate recognition, such as binding to effector proteins from pathogens, and thus are involved in the initiation of signalling by TIR-NLR receptors [[cite:PUB00098643], [cite:PUB00098642]]. Presence of C-JID (or post-LRR) and its importance for the function of Arabidopsis TIR-NLR RPS4 that partners with RRS1 for effector recognition suggest that C-JID has additional functions [[cite:PUB00100183], [cite:PUB00100185], [cite:PUB00100186]].	INTERPRO
IPR023558	Tryptophan RNA-binding attenuator protein domain	The tryptophan RNA-binding attenuation protein (TRAP) regulates expression of the tryptophan biosynthetic genes in Bacillus sp. by binding to the leader region of the nascent trp operon mRNA [[cite:PUB00025371]]. The crystal structure of the Trp RNA-binding attenuation protein of Bacillus subtilis (mtrB, [swissprot:P19466]) has been solved [[cite:PUB00004208]]. TRAP forms an oligomeric ring consisting of 11 single-domain subunits, where each subunit adopts a double-stranded β-helix structure with the appearance of a β-sandwich of distinct architecture and jelly-roll fold. The 11 subunits are stabilised by 11 inter-subunit strands, forming a β-wheel with a large central hole. TRAP is activated by binding to tryptophan in clefts between adjacent β-strands, which induces conformational changes in the protein. Activated TRAP binds an mRNA target sequence consisting of 11 (G/U)AG repeats, separated by 2-3 spacer nucleotides. The spacer nucleotides do not make direct contact with the TRAP protein, but they do influence the conformation of the RNA, which might influence the specificity of TRAP [[cite:PUB00022801]]. This entry represents the structural domain in the TRAP family of proteins.	INTERPRO
IPR015961	Mu1 membrane penetration protein, domain I	Mu1 is an outer capsid protein that acts as a reoviral penetration agent. Non-enveloped animal reoviruses must enter host cells by membrane penetration that does not involve membrane fusion, as they lack a viral membrane. Reoviruses are activated by proteolytic cleavage in the intestinal lumen, leading to infectious subviral particles. The core of the virus is coated by a layer of mu1 and sigma3 proteins. Proteases strip off sigma3 exposing mu1, which provides the membrane penetration machinery that perforates the membrane. In addition, N-terminal myristoylation of polypeptide Mu1 is required for site-specific cleavage to Mu1C in transfected cells [[cite:PUB00036074]]. Mu1 forms a trimer, where the three mu1 molecules are coiled around one another with a right-handed twist. The mu1 chain folds into four distinct domains: three intertwined, predominantly α helical domains and a jelly-roll β-sandwich [[cite:PUB00013280]].	INTERPRO
IPR015962	Mu1 membrane penetration protein, domain II	Mu1 is an outer capsid protein that acts as a reoviral penetration agent. Non-enveloped animal reoviruses must enter host cells by membrane penetration that does not involve membrane fusion, as they lack a viral membrane. Reoviruses are activated by proteolytic cleavage in the intestinal lumen, leading to infectious subviral particles. The core of the virus is coated by a layer of mu1 and sigma3 proteins. Proteases strip off sigma3 exposing mu1, which provides the membrane penetration machinery that perforates the membrane. In addition, N-terminal myristoylation of polypeptide Mu1 are required for site-specific cleavage to Mu1C in transfected cells [[cite:PUB00036074]]. Mu1 forms a trimer, where the three mu1 molecules are coiled around one another with a right-handed twist. The mu1 chain folds into four distinct domains: three intertwined, predominantly α helical domains and a jelly-roll β-sandwich [[cite:PUB00013280]].	INTERPRO
IPR044937	Mu1 membrane penetration protein, domain III	Mu1 is an outer capsid protein that acts as a reoviral penetration agent. Non-enveloped animal reoviruses must enter host cells by membrane penetration that does not involve membrane fusion, as they lack a viral membrane. Reoviruses are activated by proteolytic cleavage in the intestinal lumen, leading to infectious subviral particles. The core of the virus is coated by a layer of mu1 and sigma3 proteins. Proteases strip off sigma3 exposing mu1, which provides the membrane penetration machinery that perforates the membrane. In addition, N-terminal myristoylation of polypeptide Mu1 are required for site-specific cleavage to Mu1C in transfected cells [[cite:PUB00036074]]. Mu1 forms a trimer, where the three mu1 molecules are coiled around one another with a right-handed twist. The mu1 chain folds into four distinct domains: three intertwined, predominantly α helical domains and a jelly-roll β-sandwich [[cite:PUB00013280]].	INTERPRO
IPR036262	Resistin-like superfamily	This superfamily consists of several mammalian resistin proteins. Resistin is a 12.5kDa cysteine-rich secreted polypeptide first reported from rodent adipocytes. It belongs to a multigene family termed RELMs or FIZZ proteins. Plasma resistin levels are significantly increased in both genetically susceptible and high-fat-diet-induced obese mice. Immunoneutralisation of resistin improves hyperglycemia and insulin resistance in high-fat-diet-induced obese mice, while administration of recombinant resistin impairs glucose tolerance and insulin action in normal mice. It has been demonstrated that increases in circulating resistin levels markedly stimulate glucose production in the presence of fixed physiological insulin levels, whereas insulin suppressed resistin expression. It has been suggested that resistin could be a link between obesity and type 2 diabetes [[cite:PUB00012942]]. The resistin structure has a disulfide-rich six-stranded β-sandwich fold and jelly-roll topology.	INTERPRO
IPR036256	Mu1/VP4 superfamily	"This entry includes outer capsid proteins Mu1 and VP4.

Mu1 is an outer capsid protein that acts as a reoviral penetration agent. Non-enveloped animal reoviruses must enter host cells by membrane penetration that does not involve membrane fusion, as they lack a viral membrane. Reoviruses are activated by proteolytic cleavage in the intestinal lumen, leading to infectious subviral particles. The core of the virus is coated by a layer of mu1 and sigma3 proteins. Proteases strip off sigma3 exposing mu1, which provides the membrane penetration machinery that perforates the membrane. In addition, N-terminal myristoylation of polypeptide Mu1 are required for site-specific cleavage to Mu1C in transfected cells [[cite:PUB00036074]]. Mu1 forms a trimer, where the three mu1 molecules are coiled around one another with a right-handed twist. The mu1 chain fold consists of four distinct domains, three intertwined, predominantly α helical domains and a jelly-roll β-sandwich [[cite:PUB00013280]]."	INTERPRO
IPR016110	Adenovirus Pll, hexon, subdomain 3	Hexon is a major coat protein found in various species-specific Adenoviruses, which are type II dsDNA viruses. Hexon coat proteins are synthesised during late infection and form homo-trimers. The 240 copies of the hexon trimer that are produced are organised so that 12 lie on each of the 20 facets. The central 9 hexons in a facet are cemented together by 12 copies of polypeptide IX. The penton complex, formed by the peripentonal hexons and base hexon (holding in place a fibre), lie at each of the 12 vertices [[cite:PUB00003331]]. The hexon coat protein is a duplication consisting of two domains with a similar fold packed together like the nucleoplasmin subunits. Within a hexon trimer, the domains are arranged around a pseudo 6-fold axis. The domains have a β-sandwich structure consisting of 8 strands in two sheets with a jelly-roll topology; each domain is heavily decorated with many insertions [[cite:PUB00022393]]. This entry represents a structural subdomain with a complex α/β topology.	INTERPRO
IPR044942	Adenovirus Pll, hexon, subdomain 2	This entry represents a structural subdomain with a complex α/β topology. Hexon is a major coat protein found in various species-specific Adenoviruses, which are type II dsDNA viruses. Hexon coat proteins are synthesised during late infection and form homo-trimers. The 240 copies of the hexon trimer that are produced are organised so that 12 lie on each of the 20 facets. The central 9 hexons in a facet are cemented together by 12 copies of polypeptide IX. The penton complex, formed by the peripentonal hexons and base hexon (holding in place a fibre), lie at each of the 12 vertices [[cite:PUB00003331]]. The hexon coat protein is a duplication consisting of two domains with a similar fold packed together like the nucleoplasmin subunits. Within a hexon trimer, the domains are arranged around a pseudo 6-fold axis. The domains have a β-sandwich structure consisting of 8 strands in two sheets with a jelly-roll topology; each domain is heavily decorated with many insertions [[cite:PUB00022393]].	INTERPRO
IPR022404	Diphtheria toxin, receptor-binding domain	"This entry represents the C-terminal receptor-binding domain, also known as the R domain. This domain has a β-sandwich fold consisting of nine strands in two sheet with greek-key topology; it is a subclass of immunoglobin-like fold [[cite:PUB00037609]]. The R domain binds to cell surface receptor, permitting the toxin to enter the cell by receptor mediated endocytosis [[cite:PUB00005016], [cite:PUB00000429]]. Diphtheria toxin ([ec:2.4.2.36]) is a 58kDa protein secreted by lysogenic strains of Corynebacterium diphtheriae. The toxin causes the disease diphtheria in humans by gaining entry into the cell cytoplasm and inhibiting protein synthesis [[cite:PUB00000429]]. The mechanism of inhibition involves transfer of the ADP-ribose group of NAD to elongation factor-2 (EF-2), rendering EF-2 inactive. The catalysed reaction is as follows:


&lt;reaction&gt;
NAD&lt;sup&gt;+&lt;/sup&gt; + peptide diphthamide = nicotinamide + peptide N-(ADP-D-ribosyl)diphthamide
&lt;/reaction&gt;


The crystal structure of the diphtheria toxin homodimer has been determined to 2.5A resolution [[cite:PUB00004122]]. The structure reveals a Y-shaped molecule of 3 domains, a catalytic domain (fragment A), whose fold is of the α+β type; a transmembrane (TM) domain, which consists of 9 α-helices, 2 pairs of which may participate in pH-triggered membrane insertion and translocation; and a receptor-binding domain, which forms a flattened β-barrel with a jelly-roll-like topology [[cite:PUB00004122]]. The TM- and receptor binding-domains together constitute fragment B."	INTERPRO
IPR000386	Haemagglutinin, influenzavirus B	"Haemagglutinin (HA) is one of two main surface fusion glycoproteins embedded in the envelope of influenza viruses, the other being neuraminidase (NA). There are sixteen known HA subtypes (H1-H16) and nine NA subtypes (N1-N9), which together are used to classify influenza viruses (e.g. H5N1). The antigenic variations in HA and NA enable the virus to evade host antibodies made to previous influenza strains, accounting for recurrent influenza epidemics [[cite:PUB00033165]]. The HA glycoprotein is present in the viral membrane as a single polypeptide (HA0), which must be cleaved by the host's trypsin-like proteases to produce two peptides (HA1 and HA2) in order for the virus to be infectious. Once HA0 is cleaved, the newly exposed N-terminal of the HA2 peptide then acts to fuse the viral envelope to the cellular membrane of the host cell, which allows the viral negative-stranded RNA to infect the host cell. The type of host protease can influence the infectivity and pathogenicity of the virus.

The haemagglutinin glycoprotein is a trimer containing three structurally distinct regions: a globular head consisting of anti-parallel β-sheets that form a β-sandwich with a jelly-roll fold (contains the receptor binding site and the HA1/HA2 cleavage site); a triple-stranded, coiled-coil, α-helical stalk; and a globular foot composed of anti-parallel β-sheets [[cite:PUB00033162], [cite:PUB00033164]]. Each monomer consists of an intact HA0 polypeptide with the HA1 and HA2 regions linked by disulphide bonds. The N terminus of HA1 provides the central strand in the 5-stranded globular foot, while the rest of the HA1 chain makes its way to the 8-stranded globular head.  HA2 provides two α helices, which form part of the triple-stranded coiled-coil that stabilises the trimer, its C terminus providing the remaining strands of the 5-stranded globular foot. This entry represents haemagglutinin found in influenza virus B."	INTERPRO
