Accession	Name	Description	Source Database
IPR008987	Baseplate structural protein Gp9/Gp10	The members of this family are similar to gene products 9 (gp9) and 10 (gp10) of bacteriophage T4. Both proteins are components of the viral baseplate [[cite:PUB00016498]]. Gp9 connects the long tail fibres of the virus to the baseplate and triggers tail contraction after viral attachment to a host cell. The protein is active as a trimer, with each monomer being composed of three domains. The N-terminal domain consists of an extended polypeptide chain and two α helices. The alpha1 helix from each of the three monomers in the trimer interacts with its counterparts to form a coiled-coil structure. The middle domain is a seven-stranded β-sandwich that is thought to be a novel protein fold. The C-terminal domain is thought to be essential for gp9 trimerisation and is organised into an eight-stranded antiparallel β-barrel, which was found to resemble the 'jelly roll' fold found in many viral capsid proteins. The long flexible region between the N-terminal and middle domains may be required for the function of gp9 to transmit signals from the long tail fibres [[cite:PUB00010705]]. Together with gp11, gp10 initiates the assembly of wedges that then go on to associate with a hub to form the viral baseplate [[cite:PUB00016498]]. This entry represents the N-terminal domain of Gp10, that in Gp9 covers the full length.	INTERPRO
PF07880	Bacteriophage T4 gp9/10-like protein	The members of this family are similar to gene products 9 (gp9) and 10 (gp10) of bacteriophage T4. Both proteins are components of the viral baseplate [[cite:PUB00016498]]. Gp9 (Swiss:P10927) connects the long tail fibres of the virus to the baseplate and triggers tail contraction after viral attachment to a host cell. The protein is active as a trimer, with each monomer being composed of three domains.  The N-terminal domain consists of an extended polypeptide chain and two alpha helices. The alpha1 helix from each of the three monomers in the trimer interacts with its counterparts to form a coiled-coil structure. The middle domain is a seven-stranded beta-sandwich that is thought to be a novel protein fold. The C-terminal domain is thought to be essential for gp9 trimerisation and is organised into an eight- stranded antiparallel beta-barrel, which was found to resemble the 'jelly roll' fold found in many viral capsid proteins. The long flexible region between the N-terminal and middle domains may be required for the function of gp9 to transmit signals from the long tail fibres [[cite:PUB00010705]]. Together with gp11, gp10 (Swiss:P10928) initiates the assembly of wedges that then go on to associate with a hub to form the viral baseplate [[cite:PUB00016498]].	PFAM
IPR036240	Gp9-like superfamily	Members of this entry are similar to gene products 9 (gp9) and 10 (gp10) of bacteriophage T4. Both proteins are components of the viral baseplate [[cite:PUB00016498]]. Gp9 connects the long tail fibres of the virus to the baseplate and triggers tail contraction after viral attachment to a host cell. The protein is active as a trimer, with each monomer being composed of three domains.  The N-terminal domain consists of an extended polypeptide chain and two α helices. The alpha1 helix from each of the three monomers in the trimer interacts with its counterparts to form a coiled-coil structure. The middle domain is a seven-stranded β-sandwich that is thought to be a novel protein fold. The C-terminal domain is thought to be essential for gp9 trimerisation and is organised into an eight- stranded antiparallel β-barrel, which was found to resemble the 'jelly roll' fold found in many viral capsid proteins. The long flexible region between the N-terminal and middle domains may be required for the function of gp9 to transmit signals from the long tail fibres [[cite:PUB00010705]]. Together with gp11, gp10 initiates the assembly of wedges that then go on to associate with a hub to form the viral baseplate [[cite:PUB00016498]].	INTERPRO
PF22826	PL28 ulvan lyases	This entry represents the PL28 family of ulvan lyases. These enzymes degrade ulvan next to either epimer of uronic acid. They adopt a beta-sandwich structure with a jelly-roll topology containing a deep positively charged cleft that defines the substrate binding site [[cite:PUB00154170]].	PFAM
IPR015227	Mitogen, Yersinia pseudotuberculosis	Members of this family of Yersinia pseudotuberculosis mitogens adopt a sandwich structure consisting of nine strands in two β sheets, in a jelly-roll topology. As with other superantigens, they are able to excessively activate T cells by binding to the T cell receptor [[cite:PUB00029905]].	INTERPRO
PF22825	HpiC1 cyclase	This entry represents the homologues of HpiC1, a Stig cyclase that catalyzes the formation of 12-epi-hapalindole U. This enzyme folds into a beta-sandwich with jelly-roll topology that is distantly related to galactose-binding domains. HpiC1 has two integral Ca2+ ions, each with octahedral coordination geometry. Ca2+ ions are required for catalytic activity.	PFAM
IPR054720	HpiC1 cyclase	This entry represents HpiC1, a Stig cyclase that catalyses the formation of 12-epi-hapalindole U. This enzyme folds into a β-sandwich with jelly-roll topology that is distantly related to galactose-binding domains. HpiC1 has two integral Ca2 ions, each with octahedral coordination geometry. Ca2 ions are required for catalytic activity [[cite:PUB00154015]].	INTERPRO
IPR010392	Satellite virus coat	This entry represents coat proteins found in several satellite viruses, including satellite panicum mosaic virus [[cite:PUB00020147]], satellite tobacco necrosis virus, and satellite St. Augustine decline virus. The coat proteins of satellite viruses consist of a β-sandwich jelly-roll fold, with usually eight strands making up the two sheets, although some members can have an extra 1-2 strands. The characteristic interaction between the domains of this fold allows the formation of five-fold and pseudo six-fold assemblies. Although the satellite virus coat proteins share the same jelly-roll fold, they differ in the arrangement of their secondary structural elements and in the interactions of adjacent subunits [[cite:PUB00007874]].	INTERPRO
IPR009794	Anabaena sensory rhodopsin transducer	This entry represents a family of proteins found in bacteria and some archaeal species, including the Anabaena sensory rhodopsin transducer (ASRT) and the hypothetical protein TM1070 from Thermotoga maritima. ASRT, likely to bind sugars or related metabolites, is comprised of a single globular domain with an eight-stranded β-sandwich fold with a well conserved tryptophan at the start of the first strand and a nearly absolutely conserved asparagine located at the end of the second β-strand that is involved in stabilising the characteristic tight turn between strands 2 and 3 of the structure [[cite:PUB00100872], [cite:PUB00041719], [cite:PUB00100873]]. TM1070 has a β-sandwich structure with a jelly-roll fold.	INTERPRO
PF22446	Head N-terminal domain	This entry represents a compact jelly-roll beta-sandwich domain (head domain) of the polysaccharide receptor-binding protein from  Lactococcus phage 1358 [[cite:PUB00154031]].	PFAM
PF22031	Major capsid protein V20 C-terminal domain	This is the C-terminal domain of major capsid protein V20. This domain folds into a beta-sandwich with a jelly-roll topology [[cite:PUB00151820]].	PFAM
IPR009103	Olfactory marker protein	Olfactory marker protein (OMP) is a highly expressed, cytoplasmic protein found in mature olfactory sensory receptor neurons of all vertebrates. OMP is a modulator of the olfactory signal transduction cascade. The crystal structure of OMP reveals a β sandwich consisting of eight strands in two sheets with a jelly-roll topology [[cite:PUB00013265]]. Three highly conserved regions have been identified as possible protein-protein interaction sites in OMP, indicating a possible role for OMP in modulating such interactions, thereby acting as a molecular switch [[cite:PUB00013266]].	INTERPRO
IPR010092	Chlorinating enzyme	This entry represents a group of highly homologous enzymes related to dioxygenases which chlorinate amino acid methyl groups. L-threonyl-[L-threonyl-carrier protein] 4-chlorinase (SyrB2)  chlorinates the methyl group of threonine in the biosynthesis of syringomycin in Pseudomonas syringae in a reaction that requires oxygen, chloride ions, ferrous iron and α-oxoglutarate [[cite:PUB00013826], [cite:PUB00013788], [cite:PUB00100320], [cite:PUB00100321], [cite:PUB00100319]]. α-oxoglutarate seems to provide structural stability to the protein, which shows an eight-stranded anti-parallel β-sandwich 'jelly-roll' motif [[cite:PUB00040622]].	INTERPRO
IPR016828	Alpha-L-arabinofuranosidase	"Alpha-L-arabinofuranosidase hydrolyses the terminal non-reducing alpha-L-arabinofuranoside residues in alpha-L-arabinosides. The enzyme acts on alpha-L-arabinofuranosides, alpha-L-arabinans containing (1,3)-and/or (1,5)-linkages, arabinoxylans and arabinogalactans. Some beta-galactosidases ([ec:3.2.1.23]) and beta-D-fucosidases ([ec:3.2.1.38]) also hydrolyse alpha-L-arabinosides.



The enzyme is a hexamer and each monomer has two domains: a (β/α)8-barrel and a 12-stranded β sandwich with jelly-roll topology [[cite:PUB00030050]]. It has no apparent requirement for cofactors, and its activity is strongly inhibited by 1 mM Hg2+ [[cite:PUB00012951]]."	INTERPRO
IPR053887	Major capsid protein V20, C-terminal domain	This is the C-terminal domain of major capsid protein V20 from Sputnik virophage. This domain folds into a β-sandwich with a jelly-roll topology [[cite:PUB00151820]]. V20 is a major capsid protein from Sputnik virophage. This is a dsDNA virus, referred to as a virophage, that is co-assembled with Mimivirus in the host amoeba. The capsid is organized into a T = 27 lattice in which there are 260 trimeric capsomers and 12 pentameric capsomers. The trimeric capsomers consist of three double jelly-roll major capsid proteins creating pseudohexameric capsomer symmetry.	INTERPRO
IPR015289	Alpha-L-arabinofuranosidase B, catalytic	This domain, found in fungal alpha-L-arabinofuranosidase B, adopts a β-sandwich fold similar to that of concanavalin A-like lectins/glucanase. The β-sandwich fold consists of two anti-parallel β-sheets with seven and six strands, respectively. In addition, there are four helices outside of the β-strands. The β-sandwich strands are closely packed and curved with a jelly roll topology, creating a small catalytic pocket. The domain catalyses the hydrolysis of alpha-1,2-, alpha-1,3- and alpha-1,5-L-arabinofuranosidic bonds in L-arabinose-containing hemicelluloses such as arabinoxylan and L-arabinan [[cite:PUB00035358]].	INTERPRO
PF09206	Alpha-L-arabinofuranosidase B, catalytic	Members of this family, which are present in fungal alpha-L-arabinofuranosidase B, adopt a beta-sandwich fold similar to that of Concanavalin A-like lectins/glucanase. The beta-sandwich fold consists of two anti-parallel beta-sheets with seven and and six strands, respectively. In addition, there are four helices outside of the beta-strands. The beta-sandwich strands are closely packed and curved with a jelly roll topology, creating a small catalytic pocket. The domain catalyses the hydrolysis of alpha-1,2-, alpha-1,3- and alpha-1,5-L-arabinofuranosidic bonds in L-arabinose-containing hemicelluloses such as arabinoxylan and L-arabinan [[cite:PUB00035358]].	PFAM
PF09144	Yersinia pseudo-tuberculosis mitogen	Members of this family of Yersinia pseudo-tuberculosis mitogens adopt a sandwich structure consisting of nine strands in two beta sheets, in a jelly-roll topology. As with other super-antigens, they are able to excessively activate T cells by binding to the T cell receptor [[cite:PUB00029905]].	PFAM
PF18099	Carbohydrate binding module (family 35)	This is a delta4,5-anhydrogalacturonic acid-specific carbohydrate-binding module family 35, which is found in several prokaryotic proteins. Its crystal structure shows a jelly roll/beta-sandwich fold with 2 antiparallel sheets made of 4 and 5 antiparallel beta-strands [[cite:PUB00054441]]. It is also found at the end of a family of putative glycosyl hydrolases.	PFAM
IPR010400	PITH domain	"This entry represents the PITH domain (derived from Proteasome-Interacting THioredoxin). The protein Txnl1, which is a probable component of the 32kDa 26S proteasome, uses its C-terminal PITH domain to associate specifically with the 26S proteasome [[cite:PUB00053806]].

The PITH domain is dominated by a jelly roll β-sandwich structure. The β-sandwich is formed by face-to-face packing of two anti-parallel β-sheets. Another two-stranded β-sheet seals off one end of the β-barrel [[cite:PUB00038340], [cite:PUB00057965]]."	INTERPRO
PF17994	Galactofuranosyltransferase 2 N-terminal	This is the N-terminal beta-barrel domain found in the polymerizing galactofuranosyltransferase GlfT2 (Rv3808c). This enzyme synthesizes the bulk of the galactan portion of the mycolyl-arabinogalactan complex, which is the largest component of the mycobacterial cell wall such as in Mycobacterium tuberculosis. The N-terminal domain contains two short helices preceding a 10-stranded beta-sandwich with jelly roll topology [[cite:PUB00061227]].	PFAM
PF23032	ELAPOR1-like, galactose-binding domain	This domain is found in Endosome/lysosome-associated apoptosis and autophagy regulator family member 2 from humans (ELAPOR1), which may protect cells from cell death by inducing cytosolic vacuolisation and up-regulating the autophagy pathway and may play a role in apoptosis and cell proliferation. It is predicted to form a beta sandwich with a jelly roll topology typical of a galactose binding domain (GBD).	PFAM
IPR054591	PL28 ulvan lyase	"This entry includes sequences from the PL28 family of ulvan lyases. These enzymes degrade ulvan next to either epimer of uronic acid. They adopt a β-sandwich structure with a jelly-roll topology containing a deep positively charged cleft that defines the substrate binding site [[cite:PUB00154170]].

This domain is found as standalone or in combination with other domains."	INTERPRO
IPR040492	Galactofuranosyltransferase GlfT2, N-terminal	This is the N-terminal β-barrel domain found in the polymerizing galactofuranosyltransferase GlfT2 (Rv3808c). This enzyme synthesizes the bulk of the galactan portion of the mycolyl-arabinogalactan complex, which is the largest component of the mycobacterial cell wall such as in Mycobacterium tuberculosis. The N-terminal domain contains two short helices preceding a 10-stranded β-sandwich with jelly roll topology [[cite:PUB00061227]].	INTERPRO
PF23031	ELAPOR1-like, galactose binding domain	This domain is found in Endosome/lysosome-associated apoptosis and autophagy regulator family member 2 from humans (ELAPOR1), which may protect cells from cell death by inducing cytosolic vacuolisation and up-regulating the autophagy pathway and may play a role in apoptosis and cell proliferation. It is predicted to form a beta sandwich with a jelly roll topology typical of a galactose binding domain (GBD).	PFAM
PF22071	FAP42 domain B2	FAP42 is a large protein that forms the peripheral 'beam' of the C1b projection of the ciliary central apparatus (CA). This protein forms a complex with FAP413 and FAP246, which is essential for a stable assembly of the C1b, C1f and C2b projections, and loss of these proteins leads to ciliary motility defects. FAP42 structure has been determined along with other components of the Chlamydomonas reinhardtii ciliary central apparatus [1-2]. FAP42 contains cysteine peptidase domain, adenylate kinase domain, five guanylate kinase domains and three beta-sandwich domains. The latter adopt a jelly-roll topology and have a significant sequence and structural similarity to domain III in calpains and the predicted beta-sandwich domains in androglobin. This entry represents the second FAP42 beta-sandwich domain B2.	PFAM
PF22072	FAP42 domain B3	FAP42 is a large protein that forms the peripheral 'beam' of the C1b projection of the ciliary central apparatus (CA). This protein forms a complex with FAP413 and FAP246, which is essential for a stable assembly of the C1b, C1f and C2b projections, and loss of these proteins leads to ciliary motility defects. FAP42 structure has been determined along with other components of the Chlamydomonas reinhardtii ciliary central apparatus [1-2]. FAP42 contains cysteine peptidase domain, adenylate kinase domain, five guanylate kinase domains and three beta-sandwich domains. The latter adopt a jelly-roll topology and have a significant sequence and structural similarity to domain III in calpains and the predicted beta-sandwich domains in androglobin. This entry represents the third FAP42 beta-sandwich domain B3.	PFAM
IPR054096	FAP42-like, domain B2	FAP42 is a large protein that forms the peripheral 'beam' of the C1b projection of the ciliary central apparatus (CA). This protein forms a complex with FAP413 and FAP246, which is essential for a stable assembly of the C1b, C1f and C2b projections, and loss of these proteins leads to ciliary motility defects. FAP42 structure has been determined along with other components of the Chlamydomonas reinhardtii ciliary central apparatus [[cite:PUB00153933], [cite:PUB00153934]]. FAP42 contains cysteine peptidase domain, adenylate kinase domain, five guanylate kinase domains and three β-sandwich domains. The latter adopt a jelly-roll topology and have a significant sequence and structural similarity to domain III in calpains and the predicted β-sandwich domains in androglobin. This entry represents the second FAP42 β-sandwich domain B2.	INTERPRO
IPR054097	FAP42-like, domain B3	FAP42 is a large protein that forms the peripheral 'beam' of the C1b projection of the ciliary central apparatus (CA). This protein forms a complex with FAP413 and FAP246, which is essential for a stable assembly of the C1b, C1f and C2b projections, and loss of these proteins leads to ciliary motility defects. FAP42 structure has been determined along with other components of the Chlamydomonas reinhardtii ciliary central apparatus [[cite:PUB00153933], [cite:PUB00153934]]. FAP42 contains cysteine peptidase domain, adenylate kinase domain, five guanylate kinase domains and three β-sandwich domains. The latter adopt a jelly-roll topology and have a significant sequence and structural similarity to domain III in calpains and the predicted β-sandwich domains in androglobin. This entry represents the third FAP42 β-sandwich domain B3.	INTERPRO
PF14683	Polysaccharide lyase family 4, domain III	CBM-like is domain III of rhamnogalacturonan lyase (RG-lyase). The full-length protein specifically recognises and cleaves alpha-1,4 glycosidic bonds between l-rhamnose and d-galacturonic acids in the backbone of rhamnogalacturonan-I, a major component of the plant cell wall polysaccharide, pectin. This domain possesses a jelly roll beta-sandwich fold structurally homologous to carbohydrate binding modules (CBMs), and it carries two sulfate ions and a hexa-coordinated calcium ion.	PFAM
PF17991	Thioredoxin like C-terminal domain	This is the C-terminal thioredoxin like domain found in Rv2874 in the pathogenic bacterium Mycobacterium tuberculosis [[cite:PUB00091401]]. Structure analysis of Rv2874-C shows the presence of a C-terminal domain formed by the 128 residues Thr568-Gly695. These residues form a jelly-roll structure in which two antiparallel beta-sheets sandwich a hydrophobic core. This domain is combined with a second domain with a carbohydrate-binding module (CBM) fold [[cite:PUB00091402]].	PFAM
IPR041017	DipZ, thioredoxin-like C-terminal domain	This is the C-terminal thioredoxin like domain found in DipZ/Rv2874 in the pathogenic bacterium Mycobacterium tuberculosis [[cite:PUB00091401]]. Structure analysis of Rv2874-C shows the presence of a C-terminal domain formed by the 128 residues Thr568-Gly695. These residues form a jelly-roll structure in which two antiparallel β-sheets sandwich a hydrophobic core. This domain is combined with a second domain with a carbohydrate-binding module (CBM) fold [[cite:PUB00091402]].	INTERPRO
IPR029411	Rhamnogalacturonan lyase, domain III	This is domain III of rhamnogalacturonan lyase (RG-lyase). The full-length protein specifically recognises and cleaves alpha-1,4 glycosidic bonds between l-rhamnose and d-galacturonic acids in the backbone of rhamnogalacturonan-I, a major component of the plant cell wall polysaccharide, pectin. This domain possesses a jelly roll β-sandwich fold structurally homologous to carbohydrate binding modules (CBMs), and it carries two sulfate ions and a hexa-coordinated calcium ion [[cite:PUB00027701]].	INTERPRO
IPR049053	Alpha fucosidase A-like, C-terminal domain	This domain is found in Alpha-fucosidase (AFCA) from Bifidobacterium bifidum and in other members of the glycoside hydrolase family 95 from fungi, plants and bacteria. AFCA hydrolyses the glycosidic linkage of Fuc1-2Gal via an inverting mechanism. This entry represents the C-terminal β-sandwich domain that is next to the the catalytic region of this protein. The domain forms a two-layered jelly-roll fold. Its specific function remains unknown [[cite:PUB00040386], [cite:PUB00151755]].	INTERPRO
PF05603	Hikeshi-like, N-terminal domain	This domain is found at the N-terminal end of Protein Hikeshi from humans and its orthologues OPI10 from other eukaryotes. Hikeshi is an specific nuclear import carrier for HSP70 proteins following heat-shock stress, which is required to protect cells from heat- shock damages. The N-terminal domain shows a jelly-roll/beta- sandwich fold with two layers of beta-sheets consisting of three and five and five antiparallel beta-strands [[cite:PUB00101203]].	PFAM
IPR015176	Lyase, N-terminal	This entry represents a domain predominantly found in chondroitin ABC lyase I,  adopting a jelly-roll fold topology consisting of a two-layered bent β-sheet sandwich with one short α-helix. The convex β sheet is composed of five antiparallel strands, whilst the concave β-sheet contains five antiparallel β-strands with a loop between two consecutive strands folding back onto the concave surface. This domain is required for binding of the protein to long glycosaminoglycan chains [[cite:PUB00014313]].	INTERPRO
IPR041342	Carbohydrate binding module family 35	This entry represents carbohydrate-binding module family 35 [cazy:CBM35]. This domain is found in several prokaryotic proteins, including Cthe_3141 from Acetivibrio thermocellus 9 ([swissprot:A3DK57]). It has specificity for delta4,5-anhydrogalacturonic acid (d4,5-GalA), a signature molecule for plant cell wall degradation. Its crystal structure shows a jelly roll/β-sandwich fold with 2 antiparallel sheets made of 4 and 5 antiparallel β-strands [[cite:PUB00054441]]. It is also found at the end of a family of putative glycosyl hydrolases.	INTERPRO
PF09092	Lyase, N terminal	Members of this family are predominantly found in chondroitin ABC lyase I, and adopt a jelly-roll fold topology consisting of a two-layered bent beta-sheet sandwich with one short alpha-helix. The convex beta sheet is composed of five antiparallel strands, whilst the concave beta-sheet contains five antiparallel beta-strands with a loop between two consecutive strands folding back onto the concave surface. This domain is required for binding of the protein to long glycosaminoglycan chains [[cite:PUB00014313]].	PFAM
PS51532	PITH domain profile	"The proteasome-interacting thioredoxin (PITH) domain is a general proteasome-
interacting module [[cite:PUB00053806]].

The PITH domain is dominated by a jelly roll beta-sandwich structure. The beta-sandwich is formed by face-to-face packing of two anti-
parallel beta-sheets. Another two-stranded beta-sheet seals off one end of the
beta-barrel [[cite:PUB00038340]][[cite:PUB00057965]].

Some proteins known to contain a PITH domain are listed below:

 - Human  Txnl1 or TRP32, a thioredoxin-like protein implicated in endocytosis
   and in protection against glucose deprivation-induced cytotoxicity.
 - Human  C1ORF28,  an uncharacterized protein that does not contain any other
   known protein   domains,   but   has  been  found  to  associate  with  26S
   proteasomes.
 - Arabidopsis thaliana At3g04780, a single domain protein.

The profile we developed covers the entire PITH domain."	PROFILE
IPR008493	Hikeshi-like, N-terminal domain	This entry represents a domain found at the N-terminal of human Hikeshi and its orthologues OPI10 from other eukaryotes. Hikeshi acts as a specific nuclear import carrier for HSP70 proteins following heat-shock stress; it acts by mediating the nucleoporin-dependent translocation of ATP-bound HSP70 proteins into the nucleus [[cite:PUB00075511]]. The N-terminal domain shows a jelly-roll/β-sandwich fold with two layers of β-sheets consisting of three and five and five antiparallel β-strands [[cite:PUB00101203], [cite:PUB00101202]].	INTERPRO
PF21340	Cip1-like, core domain	This domain is found in Cip1 from Hypocrea jecorina and similar sequences predominantly found in fungi. Cip1 is a cellulose induced protein with a carbohydrate binding module (Pfam:PF00734) connected via a linker region to a domain with yet unknown function (this entry). This domain shows a beta- sandwich jelly-roll fold with two anti-parallel beta-sheets that consist on eight and seven strands and pack on top of one another. Structural analysis suggest it may function as a lyase [[cite:PUB00151763]].	PFAM
